<?xml version="1.0" encoding="UTF-8"?>
<!-- Listing 6.06 complex datatype with global element and attribute-->
<!DOCTYPE xs:schema PUBLIC "-//W3C//DTD XMLSCHEMA 200102//EN" 'http://www.w3.org/2001/XMLSchema.dtd'>
<xs:schema targetNamespace="http://www.nyu.edu/jws/Address" xmlns:addr="http://www.nyu.edu/jws/Address" xmlns:xs="http://www.w3.org/2001/XMLSchema">
	<xs:complexType name="USAddress">
		<xs:sequence>
			<xs:element name="name" type="xs:string"/>
			<xs:element name="street" type="xs:string"/>
			<xs:element name="city" type="xs:string"/>
			<xs:element name="state" type="xs:string"/>
			<xs:element name="zip" type="xs:string"/>
		</xs:sequence>
		<xs:attribute name="category" type="xs:string"/>
		<xs:attribute ref="addr:language"/>
	</xs:complexType>
	<xs:attribute name="language" type="xs:string"/>
	<xs:element name="address" type="addr:USAddress"/>
</xs:schema>

